[
  {
    "make": "Mazda",
    "model": "MX-5",
    "year": 2024,
    "positioning_statement": "MX-5 MX-5\n\nMX-S is the pinnacle of Mazda brand values.",
    "target_audience": "MARKET LANDSCAPE",
    "purchase_drivers_intended": [],
    "key_features_intended": [
      {
        "feature": "Automatic Climate Control",
        "category": "comfort",
        "priority": "primary",
        "messaging": "Automatic Climate Control",
        "target_sentiment": "positive"
      },
      {
        "feature": "Manual Transmission",
        "category": "performance",
        "priority": "secondary",
        "messaging": "Manual Transmission",
        "target_sentiment": "positive"
      },
      {
        "feature": "Automatic Transmission",
        "category": "performance",
        "priority": "secondary",
        "messaging": "Automatic Transmission",
        "target_sentiment": "positive"
      },
      {
        "feature": "Leather Seats",
        "category": "design",
        "priority": "secondary",
        "messaging": "Leather Seats",
        "target_sentiment": "positive"
      }
    ],
    "brand_attributes_intended": [
      "sporty",
      "reliable"
    ],
    "competitive_positioning": {
      "competitors": [
        "COMPARISON MAZDA",
        "PURCHASE REASONS"
      ],
      "market_positioning": "MX-5 MX-5\n\nMX-S is the pinnacle of Mazda brand values."
    },
    "source_page": 1,
    "raw_text": "2024 MX-5\n\nMX-S is the pinnacle of Mazda brand values.\nMX-5 is the reward purchase for most buyers.\n\nSINGLE /COUPLE FAMILY EMPTY-NESTER HALO\n=\nMX-5\nCUSTOMER PROFILE MARKET LANDSCAPE\nDEMOGRAPHICS WHERE IS THE OPPORTUNITY?\n\n+ MX-5 aims to have largest share of any non-\nAmerican sports car in the mainstream segment for\n\nSy Re 2024 with 11k sales.\n= The Sports Car segment has been flat around 153k\n$121,000 $137,000 MX-5 6% units for the past 3 years.\nChallenger = MX-5 achieved 7% share in 2021 selling over 10k.\nBS 370Z 1%\n64% 66% + January 2024 was the last month of production for\nBRZ 3% the Chevrolet Camaro.\n73% 70% GR86 7%\nSupra 2%\niy 56% 49%\nKEY COMPETITORS\nPURCHASE REASONS COMPARISON MAZDA ADV. MAZDA DISADV.\nFun to Drive, Interior\nRe lity, Handlis '\n1 Fun to Drive rovorA RSE Roadster, Quality, Handling | space\nFun to Drive, Interior\n2. Exterior Styling 2 BRZ Roadster, Quality, Handling | un*2\n3. buena MX-5 MUSTANG Quality, Handling, Nimble Interior Space, HP\n4. Previous Experience with Model\n4 Hi . , Fast,\n5. ExterionGclon fe) z. Price, Handling, Manual Tr. Luxurious, Fast, Tech\nBe | BOXSTER/ Handling, Powertrain,\nSy Price, Handling, Simplicity\n= ST & RF buyers are very similar, but RF buyers iP CAYMAN '& Simpl lity\n\npurchase more for the styling and \u201ccool factor\u201d,\nwhile ST buyers are more traditional sports car\nbuyers looking for great driving dynamics and\nperformance.\n\nKEY VALUES & FEATURE HIGHLIGHTS\n\nRETRACTABLE-FASTBACK (RF)\n\nEXTERIOR DESIGN\n\nk\nSOFT-TOP (ST)\n\n~ Black BBS wheels & Red Brembo Brakes\n\n> = Heated Black Recaro Seats, u El\n~ Black Exterior Aero Kit\n\n+ Retractable Fastback - \"Coupe\" Silhouette\n\n+ Soft-top \u2014 Lightweight Roadster\n\n+ Evolved Kodo Design Language\n\n~ Adaptive Front Lighting System\n> - Heated Leather Seats\n- Automatic Climate Control\n\n= 16\" Black, 17\u201d BBS, 17\" Machined Face or Black\n\nclus\nLIGHTWEIGHT $32,485\n+ 1990 Miata: 2,189 Ibs.\n\n= 2024 MX-5: 2,341 Ibs.\nSPORT\n$28,985\nPINNACLE OF DRIVING ENJOYMENT\n\n+ Manual Transmission\n+ Asymmetrical Limited Slip Differential Automatic Transmission only available on GT trims.\n\n50/50 Weight Distribution Aero Gray is new exterior color for 2024. Tan Nappa leather new for 2024 GT trim\n\nNew Asymmetric Limited Slip Differential & revised steering for 2024.\n\nDSC Track Mode is new for 2024 and reduces traction control intervention during aggressive driving or when\nsliding- meant for on track use only.\n2024 MX-5 debuts new headlights /taillights, new wheel designs, new gauge cluster, new center screen w/ Mazda\nConnect, Amazon Alexa, and new seat/ interior trim\n\nKinematic Posture Control\nDSC Track mode\n\nNew, Volume, or Hero Trims and Key Contents\n"
  },
  {
    "make": "Mazda",
    "model": "CX-90",
    "year": 2024,
    "positioning_statement": "CX-90 CX-90\n\nCX-90 serves as a destination for those who have a growing family or need extra seating\ncapacity, but do not want to sacrifice style, performance, or quality.",
    "target_audience": "MARKET LANDSCAPE",
    "purchase_drivers_intended": [],
    "key_features_intended": [
      {
        "feature": "3.3 TURBO",
        "category": "performance",
        "priority": "secondary",
        "messaging": "3.3 TURBO",
        "target_sentiment": "positive"
      },
      {
        "feature": "3.3TURBO",
        "category": "performance",
        "priority": "secondary",
        "messaging": "3.3TURBO",
        "target_sentiment": "positive"
      },
      {
        "feature": "369 L",
        "category": "performance",
        "priority": "secondary",
        "messaging": "369 L",
        "target_sentiment": "positive"
      },
      {
        "feature": "332 L",
        "category": "performance",
        "priority": "secondary",
        "messaging": "332 L",
        "target_sentiment": "positive"
      },
      {
        "feature": "280 HP",
        "category": "performance",
        "priority": "secondary",
        "messaging": "280 HP",
        "target_sentiment": "positive"
      },
      {
        "feature": "000 L",
        "category": "performance",
        "priority": "secondary",
        "messaging": "000 L",
        "target_sentiment": "positive"
      },
      {
        "feature": "Advanced Safety",
        "category": "technology",
        "priority": "secondary",
        "messaging": "Advanced Safety",
        "target_sentiment": "positive"
      },
      {
        "feature": "Leather Interior",
        "category": "design",
        "priority": "secondary",
        "messaging": "Leather Interior",
        "target_sentiment": "positive"
      },
      {
        "feature": "Leather Seats",
        "category": "design",
        "priority": "secondary",
        "messaging": "Leather Seats",
        "target_sentiment": "positive"
      }
    ],
    "brand_attributes_intended": [
      "premium",
      "sporty",
      "innovative",
      "reliable"
    ],
    "competitive_positioning": {
      "competitors": [],
      "market_positioning": "CX-90 CX-90\n\nCX-90 serves as a destination for those who have a growing family or need extra seating\ncapacity, but do not want to sacrifice style, performance, or quality."
    },
    "source_page": 2,
    "raw_text": "2025 CX-90\n\nCX-90 serves as a destination for those who have a growing family or need extra seating\ncapacity, but do not want to sacrifice style, performance, or quality.\n\nSINGLE /COUPLE FAMILY EMPTY-NESTER\n+\u2014\u2014f\nCX-90\nCUSTOMER PROFILE MARKET LANDSCAPE\nDEMOGRAPHICS\n2-ROW VS 3-ROW\nMHEV PHEV\n+ 3-Row dominates the Non-Premium Segment.\naa a . Sow still has a strong presence in the premium\npace.\n80% 83% mBR\nm2R\n66% 77%\nNon Premium Premium\n27% 54%\nPURCHASE REASONS ( CORMAETUORS\nCOMPARISON MAZDA ADV. A ISADV.\nMHEV PHEV ; MAZDA DISAPY\n\u201cKIN TELLURIDE Handling, HP, MPG, + Features, Price, Space\n1. 3/4 Row Seating Fuel Type 3.3 TURBO\n\u00bb ewlly mice/beal QD | xws Handing HP, meG.\u00bb | space\n3 Price /Deal Fuel Economy (a) MDx MPG, Space, Price Comfort, Tech\n4. Exterior/Styling 3\" Row Seating 3.3 TURBO S$\n\u00a9 * Price, Styling, Handling Comfort, Tech, Space\n5. Previous Exp. Value weous\n= PHEV buyer is a high-quality customer that is\n\nwell-educated.\n\n= MHEV buyer is more likely to be coming from a LINE-UP & TRIMS\n\u00a9X-9 than the PHEV buyer.\n\n~ Exclusive Nappa Leather Interiors\n\nPREMIOM PLUS \u2014> interior Ambient Lighting (SIEGES\nKEY VALUES & FEATURE HIGHLIGHTS 3.3TURBOS. $56,4501 ~ Ventilated Rear Seats $57,950)\nDESIGN & CRAFTSMANSHIP. 369 LB-FT TQ FRET b P lization Syst\n\n} ~ Driver Personalization System\n23/28 MPG $52,950 > = dseat 3\"row on Turbo $ trims $4900\" Srel\nPREMIUM PLUS PREFERRED\nE $49,945\n= 19\u00b0, 21\u201d Silver, & 21\" Machined Face Alloys 3.3 TURBO\n= Bold Front Face & Grille \u00bb. Mi ; puev\n. HP ~ Panoramic Moonroo! 4\nElegant siihouetie 332 LB-FT TQ PREMIUMISPORTINN 5, - 21\u201d Alloy Wheels\n24/28MPG $46,4001 ~ Black Signature Grille Wing, Black\nPERFORMANCE & CAPABILITY Window Trim, Black Side Mirrors 369 LB-FT TQ\n= 3 Powertrain Options with 280 HP+ Mt ; 56MPGe\n= Moonroo\n\n= 8-Speed Transmission fos > - Leather Seats\n= Up to 5,000 LB towing capacity z - 12.3\" Center Screen\n= PHEV w/ 26-mile electric range\n\nSELECT\nTECHNOLOGY & PACKAGING $37,845\n\nLarge Displays\n= Online Navigation\n= Driver Personalization System\nAdvanced Safety Features + Turbo S trims have fully painted with color matched bottom exterior molding\n+ PHEV & Turbo trims have black plastic bottom exterior molding\n= All PHEVs, 3.3 Turbo Preferred & Select have 3,500 Ib towing capacity \u2018New, Volume, or Hero Trims and Key Contents\n"
  },
  {
    "make": "Mazda",
    "model": "CX-7",
    "year": 2024,
    "positioning_statement": "CX-7 CX-7 0\n\nCX-70 serves as a destination for those upsizing from a C-CUV or downsizing from a 3-\n\nrow M-CUV.",
    "target_audience": "MARKET LANDSCAPE",
    "purchase_drivers_intended": [],
    "key_features_intended": [
      {
        "feature": "3TURBO S $55,9501 ~ Ventilated Rear Seats",
        "category": "performance",
        "priority": "primary",
        "messaging": "3TURBO S $55,9501 ~ Ventilated Rear Seats",
        "target_sentiment": "positive"
      },
      {
        "feature": "3.3 TURBO",
        "category": "performance",
        "priority": "secondary",
        "messaging": "3.3 TURBO",
        "target_sentiment": "positive"
      },
      {
        "feature": "3.3TURBO",
        "category": "performance",
        "priority": "secondary",
        "messaging": "3.3TURBO",
        "target_sentiment": "positive"
      },
      {
        "feature": "369 L",
        "category": "performance",
        "priority": "secondary",
        "messaging": "369 L",
        "target_sentiment": "positive"
      },
      {
        "feature": "280 HP",
        "category": "performance",
        "priority": "secondary",
        "messaging": "280 HP",
        "target_sentiment": "positive"
      },
      {
        "feature": "332 L",
        "category": "performance",
        "priority": "secondary",
        "messaging": "332 L",
        "target_sentiment": "positive"
      },
      {
        "feature": "Advanced Safety",
        "category": "technology",
        "priority": "secondary",
        "messaging": "Advanced Safety",
        "target_sentiment": "positive"
      },
      {
        "feature": "Leather Interior",
        "category": "design",
        "priority": "secondary",
        "messaging": "Leather Interior",
        "target_sentiment": "positive"
      }
    ],
    "brand_attributes_intended": [
      "premium",
      "sporty",
      "innovative",
      "reliable"
    ],
    "competitive_positioning": {
      "competitors": [
        "COMPARISON MAZDA"
      ],
      "market_positioning": "CX-7 CX-7 0\n\nCX-70 serves as a destination for those upsizing from a C-CUV or downsizing from a 3-\n\nrow M-CUV."
    },
    "source_page": 3,
    "raw_text": "2025 CX-7 0\n\nCX-70 serves as a destination for those upsizing from a C-CUV or downsizing from a 3-\n\nrow M-CUV.\nSINGLE /COUPLE FAMILY EMPTY-NESTER\nt a\nCx-70\n\nCUSTOMER PROFILE\n\nMARKET LANDSCAPE\n\nDEMOGRAPHICS C-CUV DISPOSER DESTINATION\n\n18% of C-CUV owners (CX-5, CX-50, etc) purchase\na larger 2-row CUV like CX-70 as their next vehicle.\n\nCx-90 CX-70\n= The M-CUV segment appeals to those upsizing\nwithout needing a third row and to those\n$154,000 aN aaa downsizing from 3-row vehicles that don\u2019t want to\nsacrifice cargo capacity.\n81% NY;\n10%\n70% =\n37% NV;\nPURCHASE REASONS KEY COMPETITORS\nCOMPARISON MAZDA ADV. MAZDA DISADV.\nCx-90 CX-70\nJeep CReROKEE Cargo, Handling, MPG 4x4, Tech, Towing\n1. Fuel Type uel T 3.3 TURBO\n2. 3 Row Seating Quality \u00ae ATLAS CROSS | _ HP, Cargo, Handling, MPG Tech, Price\n4 Quality Price /Deal 3.3 TURBO S \u00a9\nRX Cargo, Handling, Price Comfort, Tech, NVH\n5. Styling un to Drive leus 8 8\nX60 | Handling, HP, Cargo Range, Tech, Comfort\n+ CX-70 buyers utilize their vehicle for more PHEV\nindividual activities. CX-90 is better for family\naries Jeep GC axe Price, Quality, Cargo Tech, Towing, HP\n\nKEY VALUES & FEATURE HIGHLIGHTS\n\nDESIGN & CRAFTSMANSHIP\n\nLINE-UP & TRIMS\n\nPREMIUM PLUS\n\nExclusive Nappa Leather Interiors\nInterior Ambient Lighting\n\nPREMIUM PLUS\n\n3.3TURBO S $55,9501 ~ Ventilated Rear Seats\nSe seMpee PREMIUM +> = Driver Personalization System PREMIUM\n$52,450\u00a2 ~ Ventilated Front Seats $54,400\n= 19\u201d Silver, & 21\" Machined Face Alloys pHeV\n= Black Out Trim\n+ Sport Front & Rear Facias PREMIUM PLUS\n$48,900 369 LB-FT TQ\nPERFORMANCE & CAPABILITY 3.3 TURBO MPCe\n+ 3 Powertrain Options with 280 HP+\n+ 8-Speed Transmission 332 LB-FT TQ - Hands-free Liftgate\n5 oan 24/28 MPG PREMIUM > ~ 21\u00b0 Alloy Wheels\nDO towing capacity $45,9007 ~ Digital Gauge Cluster\n= PHEV w/ 26-mile electric range\nTECHNOLOGY & PACKAGING PREFERRED\n= Alexa Built-in 445\n\n= Online Navigation\n= Under Floor Storage Compartments\n\u2018Advanced Safety Features\n\nTurbo S trims are fully painted with color matched bottom exterior molding\nPHEV & 3.3 Turbo trims have black plastic bottom exterior molding\n= 3.3 Turbo Preferred & PHEV has 3,500 Ib Towing Capacity\n\nNew, Volume, or Hero Trims and Key Contents\n"
  },
  {
    "make": "Mazda",
    "model": "CX-50",
    "year": 2024,
    "positioning_statement": "CX-50 CX-50\n\nLike CX-5, CX-50 has appeal across all life stages, but is targeting buyers who enjoy\nbeing outside & want a vehicle that enables their active pursuits.",
    "target_audience": "DEMOGRAPHICS",
    "purchase_drivers_intended": [],
    "key_features_intended": [
      {
        "feature": "5 Turbo trims and HEV Premium Plus have silver bumper garnish Front & Rear.",
        "category": "performance",
        "priority": "primary",
        "messaging": "5 Turbo trims and HEV Premium Plus have silver bumper garnish Front & Rear.",
        "target_sentiment": "positive"
      },
      {
        "feature": "500 L",
        "category": "performance",
        "priority": "secondary",
        "messaging": "500 L",
        "target_sentiment": "positive"
      },
      {
        "feature": "2.5 TURBO",
        "category": "performance",
        "priority": "secondary",
        "messaging": "2.5 TURBO",
        "target_sentiment": "positive"
      },
      {
        "feature": "250 HP",
        "category": "performance",
        "priority": "secondary",
        "messaging": "250 HP",
        "target_sentiment": "positive"
      },
      {
        "feature": "320 L",
        "category": "performance",
        "priority": "secondary",
        "messaging": "320 L",
        "target_sentiment": "positive"
      },
      {
        "feature": "191 HP",
        "category": "performance",
        "priority": "secondary",
        "messaging": "191 HP",
        "target_sentiment": "positive"
      },
      {
        "feature": "186 L",
        "category": "performance",
        "priority": "secondary",
        "messaging": "186 L",
        "target_sentiment": "positive"
      },
      {
        "feature": "219 HP",
        "category": "performance",
        "priority": "secondary",
        "messaging": "219 HP",
        "target_sentiment": "positive"
      },
      {
        "feature": "163 L",
        "category": "performance",
        "priority": "secondary",
        "messaging": "163 L",
        "target_sentiment": "positive"
      },
      {
        "feature": "Panoramic Roof",
        "category": "design",
        "priority": "secondary",
        "messaging": "Panoramic Roof",
        "target_sentiment": "positive"
      }
    ],
    "brand_attributes_intended": [
      "premium",
      "sporty",
      "practical",
      "reliable"
    ],
    "competitive_positioning": {
      "competitors": [
        "COMPARISON MAZDA"
      ],
      "market_positioning": "CX-50 CX-50\n\nLike CX-5, CX-50 has appeal across all life stages, but is targeting buyers who enjoy\nbeing outside & want a vehicle that enables their active pursuits."
    },
    "source_page": 4,
    "raw_text": "CUSTOMER PROFILE\n\nDEMOGRAPHICS\n\nGAs HYBRID\n[=]! $136,000 \u201c\u201d\n@) 64% \u201c\u201d\nen \u201c\u201d\nFer 18% =\n\nPURCHASE REASONS\n\nGAS HYBRID\nxpected Rea\n\n1 Quality Fuel Type\n\n2. Exterior Styling Fuel Economy\n\n3. Price/Deal Reliability\n\n4, Reliability Price/Deal\n\n5. Fun to Drive Styling\n\n+ Hybrid buyers are intentionally shopping hybrids\nand prioritize practical attributes in their decision\nmaking.\n\nKEY VALUES & FEATURE HIGHLIGHTS\n\nDESIGN & CRAFTSMANSHIP\n\n= 19\" HEV PP, 18\" Meridian, 20\" 2.5S PP and up\n+ 17\" Black Alloy Wheels Standard\n+ Tough, low & wide exterior stance\n\nPERFORMANCE & CAPABILITY\nStandard AWD\n\n= 3 Powertrain Options\n Mi-Drive Modes\n\n= 3,500 LB Towing or 38 MPG.\n\nTECHNOLOGY & PACKAGING\n\n= Deep Cargo area for long items\n\nLow High Strength roof for access & accessories\nPanoramic Roof\n\nLarge Rear Seat Leg-room\n\n2025 CX-50\n\nLike CX-5, CX-50 has appeal across all life stages, but is targeting buyers who enjoy\nbeing outside & want a vehicle that enables their active pursuits.\n\nURBAN\na\n\nCX-5\n\nMARKET LANDSCAPE\n\n2025 POWERTAIN SPLIT\n(Projected Total Industry)\n\nNEUTRAL\n\n82% Other \u00ab\nSegments\n\nOUTDOOR\n=\n\nCX-50\n\n+ =\n\nCX-50 HYBRID \u00a9\n\nGas C-CUVs will continue as the most popular\npowertrain choice.\n\nGas will become more entry focused and customers\nwill pay more for alternative powertrains.\n\nHybrids will make up 15% of the total industry by\n2025 with C-CUVs making up the largest portion of\n\nHybrid sales.\nKEY COMPETITORS\nCOMPARISON MAZDA ADV. MAZDA DISADV.\nIN'5) RAV4 Styling, Performance, Interior | MPG, Space, Reputation\nTovora\nGAs\n2, OUTBACK Styling, Performance, Quality | Comfort, Space, Image\nSi RAV4 HYBRID | Styling, Handling, Interior Space, Reputation\nToVora\nHYBRID.\nW CR-V HYBRID Styling, Handling, Interior Refinement, Reputation\n\nLINE-UP & TRIMS\n\n2.5 TURBO\nPREMIUM\n250 HP\n320 LB-FT TQ 4500\n22/27 MPG\nier Te >\nPREMIUM PLUS\n$37,500\n191 HP\n186 LB-FT TQ\n26/31 MPG -\nme\n\n\u2018SELECT\n$30,300\n\n360 View Monitor\nFront & Rear Parking Sensors\nCruising & Traffic Support\nHYBRID\n\n219 HP\n163 LB-FT TQ\n39/37 MPG\n\n18\u00b0 Wheels w/ Al-Terrain Tires\n\nHeated Steering Wheel\n\nVentilated Front Seats\n\nBlack Hood Graphics\n\nPREMIUM PLUS\n$40,050\n\n= Black Roof Rails & Exhaust Tips. _5 EE]\n= Optional Red Leather\n\nPanoramic Moonroof\n\n12'peaker Bose Ao pxereneo\n\nHeated Front Seats\nPower Liftgate\nPower Driver's Seat\n\nZircon Sand Metallic only available on 2.5 Turbo Trims.\n\nTerracotta Leather only available on 2.5 Turbo Trims.\n\nTow Mode Only Available on 2.5 Turbo Trims w/ installed Hitch.\n\n2.5 Turbo trims and HEV Premium Plus have silver bumper garnish Front & Rear.\n\nOptional Red Leather Interior on Hybrid Premium & Premium Plus.\n\n\u2018New, Volume, or Hero Trims and Key Contents\n"
  },
  {
    "make": "Mazda",
    "model": "CX-5",
    "year": 2024,
    "positioning_statement": "CX-5 CX-5\n\nCX-5 is brand volume leader with appeal across all life stages.",
    "target_audience": "2025 CX-5",
    "purchase_drivers_intended": [],
    "key_features_intended": [
      {
        "feature": "Heated Steering Wheel & Rear Seats",
        "category": "design",
        "priority": "primary",
        "messaging": "Heated Steering Wheel & Rear Seats",
        "target_sentiment": "positive"
      },
      {
        "feature": "2.5 TURBO",
        "category": "performance",
        "priority": "secondary",
        "messaging": "2.5 TURBO",
        "target_sentiment": "positive"
      },
      {
        "feature": "250 HP",
        "category": "performance",
        "priority": "secondary",
        "messaging": "250 HP",
        "target_sentiment": "positive"
      },
      {
        "feature": "186 L",
        "category": "performance",
        "priority": "secondary",
        "messaging": "186 L",
        "target_sentiment": "positive"
      },
      {
        "feature": "Power Moonroof",
        "category": "design",
        "priority": "secondary",
        "messaging": "Power Moonroof",
        "target_sentiment": "positive"
      },
      {
        "feature": "LED Headlights",
        "category": "design",
        "priority": "secondary",
        "messaging": "LED Headlights",
        "target_sentiment": "positive"
      },
      {
        "feature": "Leather Interior",
        "category": "design",
        "priority": "secondary",
        "messaging": "Leather Interior",
        "target_sentiment": "positive"
      }
    ],
    "brand_attributes_intended": [
      "premium",
      "sporty",
      "practical",
      "reliable"
    ],
    "competitive_positioning": {
      "competitors": [
        "COMPARISON MAZDA"
      ],
      "market_positioning": "CX-5 CX-5\n\nCX-5 is brand volume leader with appeal across all life stages."
    },
    "source_page": 5,
    "raw_text": "CUSTOMER PROFILE\n\n2025 CX-5\n\nCX-5 is brand volume leader with appeal across all life stages.\n\nURBAN\na\n\nCX-5\n\nMARKET LANDSCAPE\n\nNEUTRAL\n\nOUTDOOR\n=\n\nCX-50\n\nDEMOGRAPHICS 2023 C-CUV SHARE\n= The C-CUV segment is the largest and most\noxs cx-50 5 gon competitive segment in the industry.\nCRM, 14% 8% = The C-CUV segment has 20+ competitors across all\npowertrain types.\nte! $116,000 $136,000 = CX-5 hit 6% share in 2023, it\u2019s highest share ever.\n: + Hybrids are gaining quickly in the C-CUV segment.\n(CD) 63% 64% Lcx.5, 6%\nTiguan, 3% \u00b0\nSI 64% 64% A\n. Rogue, 10%\n250 RAV4, 17%\niy 14% 18% Forester,...\nPURCHASE REASONS KEY COMPETITORS\ncx-5 x-50 COMPARISON MAZDA ADV. MAZDA DISADV.\nA?) cRV AWD, Handling, Styling Space, MPG, Reputation\n1. Price /Deal Quality 2.55 HONDA\n2 Quality Exterior Styling DP RAV4 AWD, Quality, Handling, Space, MPG, Reputation\nb TOVOTA\n3. Reliability Price /Deal @ RDX Price, Styling, Quality Performance, Tech\n4, Value for Money Reliability 2.5 TURBO \u00a9\nNX Price, Handling, AWD. HP, Hybrids, Comfort\n5. Safety Features Fun to Drive eons\n\n+ \u201cFun to Drive\u2019 and \u201cVehicle Reputation\u201d are in\nCX-5 buyers\u2019 top 10 purchase reasons, but they\nprioritize practical reasons and are typically more\nprice sensitive than CX-50 buyers.\n\nKEY VALUES & FEATURE HIGHLIGHTS\n\nDESIGN & CRAFTSMANSHIP\n\n= 17\", 19\" Silver & Black, & 19\u201d Silver & Black\n+ Sleek & Sophisticated Front\n= Full Painted Exterior Trim (excl. 2.58)\n\nPERFORMANCE & CAPABILITY\n= Standard i-ActivAWD\n\n= Available 250 HP 2.5 Turbo\n\n= G-Vectoring Control +\n\nTECHNOLOGY & PACKAGING\n\n+ Active Driving Display\n\n= Smart Brake Support\n\n360 View Monitor\n\nRing Structure Unibody Construction\n\nLINE-UP & TRIMS\n\n2.5 TURBO\n\n52018#T TQ\n\n23/32 MPG \u2018CARBON TURBO\n$37,000\nPREMIUM PLUS.\n$36,5007\n\n2.58\n\n186 LB-FT TQ\n\n28/37 MPG\n\n\u2018SELECT\n$29,300\n\n- 360 View Monitor\n~ Caturra Brown Nappa Leather\n- Gunmetal Finish Front Grille\n\n~ Black Painted Exterior Body Trim\n~ Trafficjam Assist\n- Heated Steering Wheel & Rear Seats\n\n~ Red Leather Interior\n~ Polymetal Gray Exterior\n~ Wireless Apple CarPlay/ AA\n\n~ Power Moonroof\n~ Rear Power liftgate\n~ Leather Seating,\n\n~ LED Headlights\n= 10.25\" Center Display with ACP/AA\n~ Standard i-Activesense Safety Features\n\n+ Zircon Sand Metallic only available on Carbon Turbo Trim.\n+ Polymetal Gray Metallic only available on Carbon Edition Trim.\n\n= 2.58 Trim reintroduced for 2025.\n\n\u2018New, Volume, or Hero Trims and Key Contents\n"
  },
  {
    "make": "Mazda",
    "model": "CX-3",
    "year": 2024,
    "positioning_statement": "CX-3 CX-3 0\n\nCX-30 serves as a brand entry point alongside Mazda3.",
    "target_audience": "DEMOGRAPHICS",
    "purchase_drivers_intended": [],
    "key_features_intended": [
      {
        "feature": "58",
        "category": "other",
        "priority": "primary",
        "messaging": "58",
        "target_sentiment": "positive"
      },
      {
        "feature": "2.5 TURBO",
        "category": "performance",
        "priority": "secondary",
        "messaging": "2.5 TURBO",
        "target_sentiment": "positive"
      },
      {
        "feature": "191 HP",
        "category": "performance",
        "priority": "secondary",
        "messaging": "191 HP",
        "target_sentiment": "positive"
      },
      {
        "feature": "250 HP",
        "category": "performance",
        "priority": "secondary",
        "messaging": "250 HP",
        "target_sentiment": "positive"
      },
      {
        "feature": "320 L",
        "category": "performance",
        "priority": "secondary",
        "messaging": "320 L",
        "target_sentiment": "positive"
      },
      {
        "feature": "Leather Interior",
        "category": "design",
        "priority": "secondary",
        "messaging": "Leather Interior",
        "target_sentiment": "positive"
      }
    ],
    "brand_attributes_intended": [
      "sporty",
      "practical",
      "reliable"
    ],
    "competitive_positioning": {
      "competitors": [
        "Std X1",
        "COMPARISON MAZDA"
      ],
      "market_positioning": "CX-3 CX-3 0\n\nCX-30 serves as a brand entry point alongside Mazda3."
    },
    "source_page": 6,
    "raw_text": "CUSTOMER PROFILE\n\nDEMOGRAPHICS\n\n2.58 2.5 TURBO\nte! $82,000 $105,000\n(CD) 43% 49%\nSI 62% 59%\nFer 12% \u2122%\nPURCHASE REASONS.\n\n2.58 2.5 TURBO\n1 Price /Deal Price/ Deal\n2. Reliability Fun to Drive\n3. Quality Quality\n4 Value for Money Exterior Styling\n5. Safety Features Performance\n\n+ 2.5 S buyers are practical and price driven.\n\n+ 2.5 Turbo buyers are performance & style driven\nwhile still prioritizing their budget.\n\nKEY VALUES & FEATURE HIGHLIGHTS\n\nDESIGN & CRAFTSMANSHIP\n\n+ 16\" (2.55), 18\u201d Silver or Black Alloy Wheels\n+ Sleek & Sophisticated Exterior\n\n+ Sculpted Dash & High Material Quality\n\n+ Best in Class Interior Quietness\n\nPERFORMANCE & CAPABILITY\n= Standard 191 HP 2.58\n\n= Standard i-ActivAWD\n\n= Available 250 HP 2.5 Turbo\n\n+ G-Vectoring Control +\n\nTECHNOLOGY & PACKAGING\n= Rear Power Liftgate\n\n= 12 Speaker Bose Audio System\n\n\u2018Active Driving Display\n\nHigh Level of Standard Safety Equipment\n\n2025 CX-3 0\n\nCX-30 serves as a brand entry point alongside Mazda3.\n\nSINGLE /COUPLE FAMILY EMPTY-NESTER\na +\nCx-30\nMARKET LANDSCAPE\n2023 B-CUV 2023 CX-30 + CX-30 has successfully captured more males than\nGENDER SPLIT GENDER SPLIT the segment average, but we are missing the bulk of\nB-CUV buyers who are females.\n+ B-CUVis one of the only majority female segments\nof all vehicle segments.\nMale 37% Male 47a, = B-CUV shoppers are price sensitive like C-Car\nFemale > = Female customers, but are willing to pay more for the driving\n\nposition and space of a B-CUV.\n\nKEY COMPETITORS\n\nCOMPARISON MAZDA ADV. MAZDA DISADV.\n\nW HRY Styling, Features, HP MPG, Space, Awareness\n2.55 ws\n\n@ ity, Space,\n\n=, CROSSTREK Styling, Handling, HP Aisi 5\n\n(5) x1 Price, Turbo HP vs Std X1 Performance, Space, Tech\n2.5 TURBO\n\nCED Price, HP Tech, Comfort\n\nLINE-UP & TRIMS\n\n~ 360 View Monitor\n~ Cruising & Traffic Support\n~ Smart Brake Support ~ Rear & Rear Crossing\n\n2.5 TURBO PRENTONT\n$35,140\n320 LB-FT TQ\n23/32 MPG CARBON TURBO\n$32,940\n~ Standard Manual Trans.\n~ Active Driving Display\n2.58 ~ Red Leather Interior\n18618 FT TQ ~ Wireless Apple CarPlay/ AA\n28/37 MPG\nPREFERRED\n$28,940\n\n~ Alexa Built-in (new)\n-> _~ Leatherette Seating\nBlack Mirror Caps\n~ Optional Ceramic Metallic Paint\n\n2.58\n$24,995,\n\n+ Polymetal Gray Metallic only available on Carbon Edition & 2.5 Turbo trims.\n+ Select Sport, CE, and all 2.5 Turbo trims have black wheels and black mirrors caps\n\n= 2.5 Carbon Turbo is only trim available in Zircon Sand Metallic \"New, Volume, or Hero Trims and Key Contents\n"
  },
  {
    "make": "Mazda",
    "model": "MAZDA3",
    "year": 2024,
    "target_audience": "DEMOGRAPHICS",
    "purchase_drivers_intended": [],
    "key_features_intended": [
      {
        "feature": "58",
        "category": "other",
        "priority": "primary",
        "messaging": "58",
        "target_sentiment": "positive"
      },
      {
        "feature": "191 HP",
        "category": "performance",
        "priority": "secondary",
        "messaging": "191 HP",
        "target_sentiment": "positive"
      },
      {
        "feature": "250 HP",
        "category": "performance",
        "priority": "secondary",
        "messaging": "250 HP",
        "target_sentiment": "positive"
      },
      {
        "feature": "2.5 Turbo",
        "category": "performance",
        "priority": "secondary",
        "messaging": "2.5 Turbo",
        "target_sentiment": "positive"
      },
      {
        "feature": "320 L",
        "category": "performance",
        "priority": "secondary",
        "messaging": "320 L",
        "target_sentiment": "positive"
      },
      {
        "feature": "186 L",
        "category": "performance",
        "priority": "secondary",
        "messaging": "186 L",
        "target_sentiment": "positive"
      },
      {
        "feature": "Manual Transmission",
        "category": "performance",
        "priority": "secondary",
        "messaging": "Manual Transmission",
        "target_sentiment": "positive"
      },
      {
        "feature": "Leather Interior",
        "category": "design",
        "priority": "secondary",
        "messaging": "Leather Interior",
        "target_sentiment": "positive"
      }
    ],
    "brand_attributes_intended": [
      "premium",
      "sporty",
      "practical",
      "reliable"
    ],
    "competitive_positioning": {
      "competitors": [
        "COMPARISON MAZDA"
      ],
      "market_positioning": ""
    },
    "source_page": 7,
    "raw_text": "CUSTOMER PROFILE\n\nDEMOGRAPHICS\n\nSEDAN HATCHBACK\n\n$107,000 $116,000\n\n60% 60%\n\ntH\n@) 46% 42%\na\n\nFer 13% 14%\n\nPURCHASE REASONS\n\nSEDAN HATCHBACK\n1. Price /Deal Fun to Drive\n2. Reliability Manual Trans\n3. Fun to Drive Exterior Styling\n4. Quality Price/Deal\n\n5. Value Reliability\n\nSedan buyers are more price sensitive & value\ndriven than Hatchback buyers.\n\nHatchback buyers typically prioritize styling &\nperformance over price.\n\nKEY VALUES & FEATURE HIGHLIGHTS\n\nDESIGN & CRAFTSMANSHIP\n\n16\" (2.5S), 17\u201d Silver, Gray, or Black\nHatchback- Black signature grill wing & accents\nSedan- Chrome signature grill wing & accents\nInterior Quietness & Driver Centric Design\n\nPERFORMANCE & CAPABILITY\n\nStandard 191 HP 2.58\n\nAvailable 250 HP 2.5 Turbo w/ AWD.\nAvailable Manual Transmission\nAvailable i-Activ AWD\n\nG-Vectoring Control +\n\nTECHNOLOGY & PACKAGING\n\n12 Speaker Bose Audio\nActive Driving Display\nHigh Level of Standard Safety Equipment\n\n2025 MAZDA3\n\nThe entry point to the brand, hatchback captures buyers prioritizing design & great\n\ndriving dynamics while sedan captures more practical & price sensitive buyers.\n\nSLEEK ELEGANCE\n=\n\nSEDAN\n\nMARKET LANDSC.\n\nAPE\n\nC-CAR SALES FORECAST\n\nRESTRAINED ALLURE\n=\n\nHATCHBACK\n\nC-Car segment volume has been declining but is\nforecast to grow through 2027.\n\nWhile HEV is increasing, ICE will still be the\ndominant powertrain with 500,000+ sales through\n2026\n\nC-Car is the leading segment for first time new car\nbuyers.\n\nC-Car customers are more price sensitive, seeking\nvalue and affordability.\n\noS Dd a Pa oP oh Sh PPS\nPPD DP GP PP DP Pf\nOOO Om\n\nKEY COMPETITORS\n\nCOMPARISON MAZDA ADV. MAZDA DISADV.\nA?) Civic SEDAN | Styling, Features, AWD. MPG, Space, Awareness\nSEDAN\n2, wrx Price, Quality, MPG, + HP, Space\nW CIVIC HB Styling, Features, AWD MPG, Space, Awareness\nHATCHBACK\n\u00ae GOLF GTI Price, HP, AWD, MPG Tech, Space, Image\nLINE-UP & TRIMS\nHATCHBACK\n\n2.5 TURBO\n\n250 HP\n320 LB-FT TQ\n23/32 MPG\n\n2.58\n\n191 HP\n186 LB-FT TQ\n28/37 MPG\n\nSEDAN\n\nCARBON TURBO.\n$32,100\n\nPREFERRED\n$26,340\n\na\n\n2.58\n$23,950\n\n>-\n\n- 360 View Monitor\n\n~ Cruising & Traffic Support \u00a9\n\n~ Black front air dam & rear\nspoiler\n\nCARBON TURBO.\n\n~ Standard Manual Trans.\n- 12 Speaker Bose Audio \u20ac\n~ Active Driving Display\n\nRed Leather Interior\nPolymetal Gray Exterior\nStandard i-ActivAWD\n\nPREFERRED\n$27,690\n\n\u2018Alexa Built-in (new)\nLeatherette Seating\nBlack Mirror Caps\nOptional Ceramic Metallic Paint\n\n2.58\n$24,950\n\n= i-ActivAWD is only available and standard on Carbon Edition & 2.5 Turbo trims.\n= 2.5 Sand 2.5 S$ Preferred are only trims without black wheels (Gray on HB, Silver on SD).\n1\n\n= Manual Transmission only on 2.5S Premium Hatchback.\n\nNew, Volume, or Hero Trims and Key Contents\n"
  }
]